description,font,color_palette
A modern tech startup website,Rouge Script,"#b96460,#563371,#b78936,#82dc2c,#28b34e"
A vintage coffee shop menu,Patua One,"#35ae97,#4917e8,#3edec7,#2d0b25,#f8bb90"
A minimalist photography portfolio,Numans,"#a90421,#cd8643,#dc2b6c,#10c5bb,#15c835"
A vibrant fashion e-commerce site,Bangers,"#68f006,#e8aca2,#01b2fe,#f07642,#aa299d"
A cozy bookstore flyer,Brawler,"#6779b6,#c2610f,#0ea5e3,#4b906a,#cd97bc"
A professional corporate business website,Delius Unicase,"#b7ee81,#8e29cd,#7aa04c,#004ddd,#6a04cd"
A playful kids' educational app,Linefont,"#e88eb6,#21dd51,#8c771e,#f6386b,#715d9e"
A bold and colorful travel blog,Belgrano,"#317734,#c586d7,#d2d66d,#81d385,#f067a9"
A sleek and modern real estate brochure,Water Brush,"#317734,#c586d7,#d2d66d,#81d385,#f067a9"
A retro-themed music festival poster,Zhi Mang Xing,"#0580b1,#2a2e61,#35f598,#79f619,#946cdc"
A classic wedding invitation card,GFS Didot,"#5bc97d,#c9a81d,#016bfb,#7a2e3c,#287276"
An elegant jewelry store website,Jim Nightshade,"#5636fc,#604965,#a1170d,#09fb33,#a76479"
A rustic organic farm brochure,M PLUS Code Latin,"#99d54b,#efc017,#ddf9bb,#47be48,#58da7b"
A futuristic AI tech conference poster,Zilla Slab,"#3e61b7,#886a5d,#883f15,#07609e,#ee9fd9"
A cheerful birthday party invitation,Edu AU VIC WA NT Dots,"#bceb1c,#d99730,#de5aba,#219ca7,#fccb83"
A creative digital marketing agency site,Noto Sans Georgian,"#32549b,#369bdd,#09359c,#c1654f,#d9d238"
A luxury hotel booking website,Bad Script,"#98e74b,#20a3f4,#c4595f,#a43db6,#1ed60c"
An eco-friendly product flyer,Redacted,"#14af2f,#aac1d3,#5a7d0d,#1ecb92,#65c3d1"
A stylish personal fitness trainer website,Tiro Telugu,"#bcc8a8,#dda9b6,#7875b5,#2d2be2,#9ec046"
A tech gadgets review blog,Cantata One,"#1f0542,#bad284,#d24b42,#e67979,#80d940"
A traditional cultural festival flyer,Noto Serif Myanmar,"#def0c2,#e604e7,#0f521a,#b52dce,#cf23a4"
A vibrant summer camp poster,Noto Sans Mandaic,"#14af2f,#aac1d3,#5a7d0d,#1ecb92,#65c3d1"
An artistic photography gallery site,Caprasimo,"#6779b6,#c2610f,#0ea5e3,#4b906a,#cd97bc"
A professional job portal website,Playwrite AU NSW,"#716065,#9a8eaa,#972c09,#f8b974,#d54611"
A funky online comic store,Arima,"#06a971,#b63c8f,#3c43ca,#e41fe2,#4583c9"
A serene meditation app interface,Overlock,"#3e61b7,#886a5d,#883f15,#07609e,#ee9fd9"
A sophisticated wine label design,Molengo,"#def0c2,#e604e7,#0f521a,#b52dce,#cf23a4"
A dynamic sports event poster,Playwrite CO,"#8ed882,#e27e9d,#f56541,#ee8a90,#8f21f2"
A cozy home decor catalog,Kings,"#22c7f6,#9f48ae,#dd025d,#c549ae,#069546"
A trendy vegan food blog,Copse,"#3e61b7,#886a5d,#883f15,#07609e,#ee9fd9"
An adventurous outdoor travel website,Antic,"#fc0aa5,#2d87dd,#8b771a,#f7ec89,#1e2bf4"
A creative ad agency portfolio,Unbounded,"#a064ef,#e9301b,#3f4268,#8d33b8,#db57a6"
A luxurious skincare product packaging,Cactus Classical Serif,"#6779b6,#c2610f,#0ea5e3,#4b906a,#cd97bc"
A community event invitation flyer,Marck Script,"#71c802,#1ba3fc,#dec294,#037e4b,#34236a"
A futuristic car showroom website,Klee One,"#5636fc,#604965,#a1170d,#09fb33,#a76479"
A high-energy fitness app,Playwrite HR Lijeva,"#bce76f,#437a9e,#691344,#617e9f,#a26837"
A soothing spa and wellness site,IBM Plex Sans Thai Looped,"#375818,#0aeacc,#fc2383,#b96ac0,#8bfa8f"
A chic fashion runway invite,Akatab,"#3e61b7,#886a5d,#883f15,#07609e,#ee9fd9"
A rustic bakery menu,Tiro Tamil,"#03f1c6,#5da284,#c5e716,#98c929,#c7ac09"
A youthful gaming tournament poster,Playwrite AU VIC,"#046429,#7aa7fb,#1ee63e,#9d719a,#0a7410"
An urban streetwear brand website,Adamina,"#8567aa,#82f82e,#afe769,#b27c0b,#96fca1"
A festive holiday season flyer,Play,"#01e621,#1e404c,#382607,#4addc2,#da30b2"
A modern architect portfolio,Libre Barcode 128,"#29a80e,#59fb35,#810a48,#e4de60,#66748c"
A colorful art supplies catalog,Noto Sans Gujarati,"#03f1c6,#5da284,#c5e716,#98c929,#c7ac09"
An edgy tattoo studio website,Bigshot One,"#3e61b7,#886a5d,#883f15,#07609e,#ee9fd9"
A vibrant floral shop brochure,Noto Sans Gunjala Gondi,"#b5d05f,#04ada2,#e8fdf6,#7ec631,#b235cc"
A tropical island vacation ad,Noto Sans Saurashtra,"#a86455,#af9ba0,#160068,#bd9b1b,#8a2c56"
A historic museum exhibit poster,Edu NSW ACT Foundation,"#26c0e6,#512d8e,#ed90b7,#11fea3,#163a24"
A futuristic VR app interface,Alata,"#82f87a,#0d1fa8,#96016b,#1a71dc,#4c13ab"
An elegant minimalist resume template,Noto Serif Grantha,"#5f0329,#e648a9,#bec4cc,#b35de6,#f2bc6b"
A motivational personal blog,Halant,"#0947b4,#a8285f,#6d8732,#51dcb8,#59ce34"
A trendy tech product landing page,Chango,"#14af2f,#aac1d3,#5a7d0d,#1ecb92,#65c3d1"
An educational coding bootcamp site,Playwrite HU,"#54734d,#990d54,#b7cdfb,#14f0e1,#ddd5a3"
A nostalgic retro diner menu,Arbutus Slab,"#a64457,#3b020c,#237567,#262593,#58b81b"
A dynamic dance club flyer,Noto Serif KR,"#24012c,#d2b08f,#e6e979,#629c5c,#6fcc0e"
An inspiring book club brochure,Italiana,"#01e621,#1e404c,#382607,#4addc2,#da30b2"
A clean and simple portfolio site,Kurale,"#ebdfe3,#da14f7,#379a47,#5542cf,#dea7e5"
A chic jewelry brand ad,Mingzat,"#7a48a7,#8130bb,#f51aa4,#78e43a,#9f18db"
An artsy handmade crafts store flyer,Allura,"#bcc8a8,#dda9b6,#7875b5,#2d2be2,#9ec046"
A refreshing juice brand website,Noto Sans Symbols,"#365a26,#74633a,#d19e27,#61d4e7,#539c58"
A youthful college festival poster,Paprika,"#da3a4f,#dce9ff,#f679ac,#a322f1,#6beba5"
A modern co-working space brochure,Be Vietnam Pro,"#24012c,#d2b08f,#e6e979,#629c5c,#6fcc0e"
A motivational fitness challenge invite,Lacquer,"#6320bb,#4191f1,#236756,#8ce776,#8d281e"
A luxurious yacht rental website,Joan,"#365a26,#74633a,#d19e27,#61d4e7,#539c58"
A playful toy store ad,Big Shoulders Stencil Display,"#7a48a7,#8130bb,#f51aa4,#78e43a,#9f18db"
An elegant gala dinner invitation,Chau Philomene One,"#72cd2f,#740a52,#9b8003,#d0e3f2,#c5e6ab"
A quirky social media campaign poster,Lacquer,"#46a849,#6eac4e,#addaec,#9d7373,#0e389a"
A classic newspaper front page,Bungee Shade,"#007ea3,#c17232,#e69139,#ef5d01,#9a4509"
A bold automotive magazine cover,Rubik Mono One,"#3585f8,#911eaf,#83cf97,#737624,#3eeb02"
An earthy gardening supply brochure,Moirai One,"#3e61b7,#886a5d,#883f15,#07609e,#ee9fd9"
A sleek digital product mockup site,Kaisei Opti,"#c80a93,#81095b,#b849c5,#59f514,#91128a"
A rustic wine tasting event flyer,BIZ UDPGothic,"#72cd2f,#740a52,#9b8003,#d0e3f2,#c5e6ab"
A futuristic tech webinar invite,Anta,"#7022d4,#c3ed5b,#22a4a4,#68fae9,#069176"
An artistic mural exhibition poster,Gotu,"#08990c,#02cf34,#c7d1a6,#adf2d2,#ef8969"
A modern student portal website,Caveat,"#365a26,#74633a,#d19e27,#61d4e7,#539c58"
A minimalist interior design blog,Almendra Display,"#bcc8a8,#dda9b6,#7875b5,#2d2be2,#9ec046"
A vibrant community outreach flyer,Fleur De Leah,"#716f9b,#c24746,#259a18,#23cebc,#48a532"
A classy personal chef menu,Micro 5 Charted,"#72cd2f,#740a52,#9b8003,#d0e3f2,#c5e6ab"
An adventurous scuba diving ad,Krub,"#c9add7,#1ec0d7,#96fb23,#2faf14,#56d8b8"
A calming yoga retreat flyer,Gayathri,"#a99d62,#b66e77,#788f18,#ffd8d7,#d41b7c"
A polished investment firm site,Sometype Mono,"#365a26,#74633a,#d19e27,#61d4e7,#539c58"
A vintage postcard design,Chau Philomene One,"#716f9b,#c24746,#259a18,#23cebc,#48a532"
A colorful children’s storybook cover,Gentium Book Plus,"#0580b1,#2a2e61,#35f598,#79f619,#946cdc"
A sleek urban car rental app,Alumni Sans Pinstripe,"#a99d62,#b66e77,#788f18,#ffd8d7,#d41b7c"
A luxury perfume brand website,Sawarabi Mincho,"#7a48a7,#8130bb,#f51aa4,#78e43a,#9f18db"
A dynamic basketball game poster,Hachi Maru Pop,"#822a20,#af358d,#e4e786,#eefb5d,#b5bb06"
An elegant piano concert invitation,IBM Plex Sans,"#462b91,#d31764,#610119,#acfe40,#598044"
A clean charity fundraising flyer,Trirong,"#71c802,#1ba3fc,#dec294,#037e4b,#34236a"
A youthful online learning platform,Libre Bodoni,"#a6dc14,#be5cea,#1a4833,#6ac7c6,#3783e7"
A vibrant indie music album cover,Merriweather,"#bce76f,#437a9e,#691344,#617e9f,#a26837"
An eco-friendly tech product ad,Amiri Quran,"#08990c,#02cf34,#c7d1a6,#adf2d2,#ef8969"
A modern industrial design portfolio,Style Script,"#01e621,#1e404c,#382607,#4addc2,#da30b2"
A stylish influencer’s personal site,Castoro Titling,"#e32d9a,#723cb0,#890386,#eb8089,#2d30c7"
A rustic cabin rental ad,Noto Sans Bamum,"#ca3fe2,#db71af,#6cc6bc,#3a867e,#d00335"
A cheerful holiday gift catalog,Namdhinggo,"#b96460,#563371,#b78936,#82dc2c,#28b34e"
A bold energy drink branding page,Ojuju,"#7a48a7,#8130bb,#f51aa4,#78e43a,#9f18db"
A serene nature photography blog,Noto Serif Lao,"#b5d05f,#04ada2,#e8fdf6,#7ec631,#b235cc"
A retro board game night invite,Nunito,"#98e74b,#20a3f4,#c4595f,#a43db6,#1ed60c"
An edgy rock concert poster,Smooch,"#bcc8a8,#dda9b6,#7875b5,#2d2be2,#9ec046"
A professional software agency site,Workbench,"#7022d4,#c3ed5b,#22a4a4,#68fae9,#069176"
